{
  "$schema": "http://json-schema.org/draft-04/schema#",
  "additionalProperties": false,
  "definitions": {
    "company": {
      "$ref": "file:schemas/company.json"
    },
    "person": {
      "$ref": "file:schemas/person.json"
    },
    "position": {
      "$ref": "file:schemas/position.json"
    },
    "match": {
      "$ref": "file:schemas/match.json"
    }
  },
  "id": "response.schema.json",
  "properties": {
    "companies": {
      "additionalItems": false,
      "items": {
        "$ref": "#/definitions/company"
      },
      "type": "array"
    },
    "people": {
      "items": {
        "$ref": "#/definitions/person"
      },
      "type": "array"
    },
    "positions": {
      "additionalItems": false,
      "items": {
        "$ref": "#/definitions/position"
      },
      "type": "array"
    },
    "results": {
      "items": {
        "$ref": "#/definitions/match"
      },
      "type": "array"
    },
    "id": {
      "default": "e63fa057-8b3a-462e-b257-257d5251ad2b",
      "id": "/properties/id",
      "type": "string"
    },
    "status": {
      "default": "fulfilled",
      "id": "/properties/status",
      "type": "string"
    }
  },
  "required": [
    "positions",
    "companies",
    "people"
  ],
  "type": "object"
}
