{
  "id": "e63fa057-8b3a-462e-b257-257d5251ad2b",
  "status": "fulfilled",
  "results": [
    {
      "score": 0.0396696499,
      "personId": "e78f3057-8b3a-462e-b257-257d5251ad2b",
      "positionId": "ba2383dbba375cebb69c3d7fafd05c29",
      "companyId": "1277b341ec69285d439f4321544497bb",
      "personKeywords": {
        "Ruby": 3,
        "Ember.js": 2,
        "Agile": 1
      },
      "positionKeywords": {
        "Ruby": 5,
        "DevOps": 1
      }
    }
  ],
  "people": [
    {
      "id": "e78f3057-8b3a-462e-b257-257d5251ad2b",
      "refId": "optional reference id",
      "name": "Hugo Duksis",
      "summary": "Experienced developer interested in functional programming",
      "email": "hugo@honeypot.io",
      "profileUrls": [
        "https://linkedin.com/in/duksis",
        "https://github.com/duksis",
        "https://twitter.com/duksis"
      ],
      "resumeUrl": "https://www.dropbox.com/s/pynm2ro69m51i98/HugoDuksisProfile.pdf?dl=1",
      "skills": ["backbone.js", "react.js", "flux"],
      "experienceEntries": [
        {
          "position": "airbaltic",
          "description": null,
          "custom_company": "flight support specialist",
          "technologies": [],
          "start_year": 2010,
          "end_year": 2013
        },
        {
          "position": "accenture",
          "description": null,
          "custom_company": "web developer",
          "technologies": [],
          "start_year": 2015,
          "end_year": null
        }
      ],
      "educationEntries":[
        {
          "school_name": "TU Berlin",
          "degree": "Bachelor's Degree",
          "discipline": "Computer Science",
          "start_year": 2003,
          "end_year": 2006
        }
      ],
      "publicActivity": {
        "github": {
          "followerCount": 70,
          "starCount": 13
        },
        "twitter": {
          "followerCount": 502
        },
        "stackoverflow": {
          "reputation": 6262
        }
      }
    }
  ],
  "positions": [
    {
      "id": "ba2383dbba375cebb69c3d7fafd05c29",
      "refId": "optional reference id",
      "name": "ruby",
      "description": "4+ years experience with Ruby on Rails and API's"
    }
  ],
  "companies": [
    {
      "id": "1277b341ec69285d439f4321544497bb",
      "name": "Honeypot GmbH",
      "location": [ "Berlin, Germany" ],
      "url": "https://www.honeypot.io",
      "profileUrls": [
        "https://github.com/honeypotio",
        "https://linkedin.com/company/honeypot"
      ]
    }
  ]
}
